{
  "schemaVersion": 1,
  "fixtureId": "hezo-url-address-policy-v1",
  "policyScope": "manual-url-syntax-profile-2-address-literals",
  "safety": {
    "executionBoundary": "offline-only",
    "networkAccessPermitted": false,
    "operationalUsePermitted": false,
    "inputOrigin": "project-authored-from-public-rfcs",
    "addressPolicy": "reserved-documentation-addresses-and-standard-mechanism-prefixes-only",
    "containsCapturedInputs": false,
    "containsOperationalInputs": false,
    "containsPotentiallyResolvableNames": false,
    "containsSecrets": false
  },
  "categoryCounts": {
    "canonical-ipv4": 3,
    "alternate-ipv4-rejection": 12,
    "ipv6-rfc5952-normalization": 7,
    "ipv4-mapped-ipv6": 3,
    "nat64": 2,
    "6to4": 2,
    "teredo": 2,
    "malformed-ipv6-rejection": 8,
    "zone-identifier-rejection": 3
  },
  "cases": [
    {
      "id": "ADDR-001",
      "category": "canonical-ipv4",
      "inputURL": "https://192.0.2.1/oracle",
      "expected": {
        "outcome": "accepted",
        "normalizedHost": "192.0.2.1",
        "addressFamily": "ipv4",
        "mechanism": "ordinary",
        "normalizationBasis": "rfc3986-ipv4",
        "isIPLiteral": true
      },
      "rfcReferences": [
        {
          "document": "RFC 3986",
          "section": "3.2.2",
          "url": "https://www.rfc-editor.org/rfc/rfc3986.html#section-3.2.2"
        },
        {
          "document": "RFC 5737",
          "section": "3",
          "url": "https://www.rfc-editor.org/rfc/rfc5737.html#section-3"
        }
      ],
      "rationale": "Canonical dotted decimal in TEST-NET-1 is accepted without rewriting."
    },
    {
      "id": "ADDR-002",
      "category": "canonical-ipv4",
      "inputURL": "https://198.51.100.254/oracle",
      "expected": {
        "outcome": "accepted",
        "normalizedHost": "198.51.100.254",
        "addressFamily": "ipv4",
        "mechanism": "ordinary",
        "normalizationBasis": "rfc3986-ipv4",
        "isIPLiteral": true
      },
      "rfcReferences": [
        {
          "document": "RFC 3986",
          "section": "3.2.2",
          "url": "https://www.rfc-editor.org/rfc/rfc3986.html#section-3.2.2"
        },
        {
          "document": "RFC 5737",
          "section": "3",
          "url": "https://www.rfc-editor.org/rfc/rfc5737.html#section-3"
        }
      ],
      "rationale": "Canonical dotted decimal in TEST-NET-2 is accepted without rewriting."
    },
    {
      "id": "ADDR-003",
      "category": "canonical-ipv4",
      "inputURL": "https://203.0.113.0/oracle",
      "expected": {
        "outcome": "accepted",
        "normalizedHost": "203.0.113.0",
        "addressFamily": "ipv4",
        "mechanism": "ordinary",
        "normalizationBasis": "rfc3986-ipv4",
        "isIPLiteral": true
      },
      "rfcReferences": [
        {
          "document": "RFC 3986",
          "section": "3.2.2",
          "url": "https://www.rfc-editor.org/rfc/rfc3986.html#section-3.2.2"
        },
        {
          "document": "RFC 5737",
          "section": "3",
          "url": "https://www.rfc-editor.org/rfc/rfc5737.html#section-3"
        }
      ],
      "rationale": "Canonical dotted decimal in TEST-NET-3 is accepted without rewriting."
    },
    {
      "id": "ADDR-004",
      "category": "alternate-ipv4-rejection",
      "inputURL": "https://192.0.2.01/oracle",
      "expected": {
        "outcome": "rejected",
        "reason": "alternate-ipv4-notation"
      },
      "rfcReferences": [
        {
          "document": "RFC 3986",
          "section": "3.2.2",
          "url": "https://www.rfc-editor.org/rfc/rfc3986.html#section-3.2.2"
        },
        {
          "document": "RFC 3986",
          "section": "7.4",
          "url": "https://www.rfc-editor.org/rfc/rfc3986.html#section-7.4"
        }
      ],
      "rationale": "A leading zero can trigger octal interpretation and is rejected."
    },
    {
      "id": "ADDR-005",
      "category": "alternate-ipv4-rejection",
      "inputURL": "https://0300.0000.0002.0001/oracle",
      "expected": {
        "outcome": "rejected",
        "reason": "alternate-ipv4-notation"
      },
      "rfcReferences": [
        {
          "document": "RFC 3986",
          "section": "3.2.2",
          "url": "https://www.rfc-editor.org/rfc/rfc3986.html#section-3.2.2"
        },
        {
          "document": "RFC 3986",
          "section": "7.4",
          "url": "https://www.rfc-editor.org/rfc/rfc3986.html#section-7.4"
        }
      ],
      "rationale": "Dotted octal spelling of a TEST-NET-1 address is rejected."
    },
    {
      "id": "ADDR-006",
      "category": "alternate-ipv4-rejection",
      "inputURL": "https://0xc0.0x00.0x02.0x01/oracle",
      "expected": {
        "outcome": "rejected",
        "reason": "alternate-ipv4-notation"
      },
      "rfcReferences": [
        {
          "document": "RFC 3986",
          "section": "3.2.2",
          "url": "https://www.rfc-editor.org/rfc/rfc3986.html#section-3.2.2"
        },
        {
          "document": "RFC 3986",
          "section": "7.4",
          "url": "https://www.rfc-editor.org/rfc/rfc3986.html#section-7.4"
        }
      ],
      "rationale": "Dotted hexadecimal spelling of a TEST-NET-1 address is rejected."
    },
    {
      "id": "ADDR-007",
      "category": "alternate-ipv4-rejection",
      "inputURL": "https://192.0x0.0x2.1/oracle",
      "expected": {
        "outcome": "rejected",
        "reason": "alternate-ipv4-notation"
      },
      "rfcReferences": [
        {
          "document": "RFC 3986",
          "section": "3.2.2",
          "url": "https://www.rfc-editor.org/rfc/rfc3986.html#section-3.2.2"
        },
        {
          "document": "RFC 3986",
          "section": "7.4",
          "url": "https://www.rfc-editor.org/rfc/rfc3986.html#section-7.4"
        }
      ],
      "rationale": "Mixed decimal and hexadecimal components are rejected as ambiguous."
    },
    {
      "id": "ADDR-008",
      "category": "alternate-ipv4-rejection",
      "inputURL": "https://3221225985/oracle",
      "expected": {
        "outcome": "rejected",
        "reason": "alternate-ipv4-notation"
      },
      "rfcReferences": [
        {
          "document": "RFC 3986",
          "section": "3.2.2",
          "url": "https://www.rfc-editor.org/rfc/rfc3986.html#section-3.2.2"
        },
        {
          "document": "RFC 3986",
          "section": "7.4",
          "url": "https://www.rfc-editor.org/rfc/rfc3986.html#section-7.4"
        }
      ],
      "rationale": "A single decimal integer equivalent to 192.0.2.1 is rejected."
    },
    {
      "id": "ADDR-009",
      "category": "alternate-ipv4-rejection",
      "inputURL": "https://0xc0000201/oracle",
      "expected": {
        "outcome": "rejected",
        "reason": "alternate-ipv4-notation"
      },
      "rfcReferences": [
        {
          "document": "RFC 3986",
          "section": "3.2.2",
          "url": "https://www.rfc-editor.org/rfc/rfc3986.html#section-3.2.2"
        },
        {
          "document": "RFC 3986",
          "section": "7.4",
          "url": "https://www.rfc-editor.org/rfc/rfc3986.html#section-7.4"
        }
      ],
      "rationale": "A single hexadecimal integer equivalent to 192.0.2.1 is rejected."
    },
    {
      "id": "ADDR-010",
      "category": "alternate-ipv4-rejection",
      "inputURL": "https://192.513/oracle",
      "expected": {
        "outcome": "rejected",
        "reason": "alternate-ipv4-notation"
      },
      "rfcReferences": [
        {
          "document": "RFC 3986",
          "section": "3.2.2",
          "url": "https://www.rfc-editor.org/rfc/rfc3986.html#section-3.2.2"
        },
        {
          "document": "RFC 3986",
          "section": "7.4",
          "url": "https://www.rfc-editor.org/rfc/rfc3986.html#section-7.4"
        }
      ],
      "rationale": "A two-component historical spelling equivalent to 192.0.2.1 is rejected."
    },
    {
      "id": "ADDR-011",
      "category": "alternate-ipv4-rejection",
      "inputURL": "https://192.0.513/oracle",
      "expected": {
        "outcome": "rejected",
        "reason": "alternate-ipv4-notation"
      },
      "rfcReferences": [
        {
          "document": "RFC 3986",
          "section": "3.2.2",
          "url": "https://www.rfc-editor.org/rfc/rfc3986.html#section-3.2.2"
        },
        {
          "document": "RFC 3986",
          "section": "7.4",
          "url": "https://www.rfc-editor.org/rfc/rfc3986.html#section-7.4"
        }
      ],
      "rationale": "A three-component historical spelling equivalent to 192.0.2.1 is rejected."
    },
    {
      "id": "ADDR-012",
      "category": "alternate-ipv4-rejection",
      "inputURL": "https://+192.0.2.1/oracle",
      "expected": {
        "outcome": "rejected",
        "reason": "alternate-ipv4-notation"
      },
      "rfcReferences": [
        {
          "document": "RFC 3986",
          "section": "3.2.2",
          "url": "https://www.rfc-editor.org/rfc/rfc3986.html#section-3.2.2"
        }
      ],
      "rationale": "A leading plus sign is outside the IPv4address grammar and is rejected."
    },
    {
      "id": "ADDR-013",
      "category": "alternate-ipv4-rejection",
      "inputURL": "https://-192.0.2.1/oracle",
      "expected": {
        "outcome": "rejected",
        "reason": "alternate-ipv4-notation"
      },
      "rfcReferences": [
        {
          "document": "RFC 3986",
          "section": "3.2.2",
          "url": "https://www.rfc-editor.org/rfc/rfc3986.html#section-3.2.2"
        }
      ],
      "rationale": "A leading minus sign is outside the IPv4address grammar and is rejected."
    },
    {
      "id": "ADDR-014",
      "category": "alternate-ipv4-rejection",
      "inputURL": "https://192.0.2.256/oracle",
      "expected": {
        "outcome": "rejected",
        "reason": "malformed-ipv4"
      },
      "rfcReferences": [
        {